{
  "slice_type": "command",
  "change_type": "feature",
  "title": "Cancel Order",
  "stakeholder": "Customer support agent",
  "trigger": "Agent calls cancel-order with an order ID",
  "success_outcome": "Order is cancelled and confirmation is returned",
  "tldr": "Cancel a pending order; reject if already shipped or not owned.",
  "scope": {
    "in": ["Validate ownership", "Set order status to cancelled"],
    "out": ["Refund processing", "Notification emails"]
  },
  "behavior": "Look up the order by ID. Verify the requesting user owns it. If the order is already shipped, reject with an error. Otherwise set status to cancelled and return the updated order.",
  "business_rules": "BR-1: A user may only cancel their own orders.\nBR-2: Orders with status SHIPPED cannot be cancelled.",
  "acceptance_scenarios": [
    "Given a pending order owned by the user, when cancel-order is called, then the order status becomes cancelled.",
    "Given an order owned by another user, when cancel-order is called, then the request is rejected.",
    "Given a shipped order, when cancel-order is called, then the request is rejected."
  ],
  "inputs_outputs_errors": "Input: order_id (string, required).\nOutput: cancelled order object.\nErrors: ORDER_NOT_OWNED when the order belongs to a different user; ORDER_ALREADY_SHIPPED when the order status is SHIPPED.",
  "e2e": {
    "scenarios": [
      {"name": "cancel_pending_order", "description": "Cancel a pending order owned by the requesting user.", "expected_outcome": "Order status becomes cancelled."},
      {"name": "reject_shipped_order_cancel", "description": "Attempt to cancel a shipped order.", "expected_outcome": "Request is rejected with ORDER_ALREADY_SHIPPED error."}
    ]
  },
  "proof": {
    "how": "We walk through cancelling a real order and see it flip to 'cancelled', then try to cancel an order that already shipped and see it refused, and try to cancel someone else's order and see it refused.",
    "why": "These three walk-throughs cover exactly the promise: your own pending order can be cancelled, and the two cases that must never succeed (already shipped, not yours) are actively blocked — so if all three behave as described, the feature does what was asked.",
    "checks": [
      {"functional": "Cancelling my own pending order marks it as cancelled.", "technical": "An automated test cancels a pending order owned by the caller and asserts the status becomes cancelled."},
      {"functional": "A shipped order cannot be cancelled.", "technical": "An automated test attempts to cancel a SHIPPED order and asserts an ORDER_ALREADY_SHIPPED error with no state change."},
      {"functional": "I cannot cancel an order that isn't mine.", "technical": "An automated test attempts to cancel an order owned by another user and asserts an ORDER_NOT_OWNED error."}
    ]
  },
  "verify_commands": ["go test ./..."],
  "definition_of_done": ["All acceptance scenarios pass", "Unit tests green"],
  "readiness": "blocked",
  "blockers": [
    {"kind": "question", "text": "Should cancellation be allowed for orders in PROCESSING status?"}
  ],
  "security_relevant": false
}
